"US","US","P","B2","Integrating protocols for infusion management","Methods, computer systems and computer readable media for receiving data from infusion pumps in a healthcare setting and displaying the data on a user device are provided. Centralized clinician views are provided to manage individual patient infusions according to selected protocols. Embodiments provide near real-time graphical displays of infusion data to clinicians on separate user devices. In addition, near real-time graphical displays of patient physiologic data is displayed simultaneously to a clinician along with the infusion data.","1. One or more non-transitory computer storage media having computer-executable instructions embodied thereon, that when executed, perform a method for displaying infusion documentation, the method comprising: receiving a continuous data feed from at least one device operable to assist in treating a patient;receiving a selected protocol for the patient from available protocols, the available protocols being presented in order of most frequent use;receiving a time range for the selected protocol;displaying data received from the at least one device according to the selected protocol for the selected time range, wherein displaying data comprises presenting a clinician with a display depicting data at approximate times corresponding to an interval associated with the selected protocol, and further wherein when a cursor is positioned to hover over a single cell the approximate times with multiple data entries are presented to the clinician with all available data entries for each approximate time associated with the single cell, in addition to the actual point in time the data was received; andcustomizing a view of the data, wherein customizing the view of the data comprises: receiving a selection of a subset of the time range associated with the selected protocol; receiving a selection of a customized interval for the subset of the time range; and displaying data received from the at least one device according to the customized interval for the subset of the time range.","14","12/890403","2010-09-24","2011-0078608","2011-03-31","8990722","2015-03-24","CERNER INNOVATION, INC.","Mary  Gannon | Amanda  Buckley | Hannah  Fiechtner | Stephanie L.  Rogers","","","","A61M-0005/172","A61M-0005/172 | G06F-0017/246 | G06Q-0050/24 | G06F-0019/327 | G06Q-0050/22 | G06F-0019/322 | G06F-0019/3468","G06F-003/048","G06F-003/048 | G06Q-050/00 | G06Q-010/00 | G08B-021/00 | A61M-005/172 | G06Q-050/22 | G06F-017/24 | G06Q-050/24 | G06F-019/00","715/771","715/771 | 715/764 | 705/002 | 705/003","","","","4915014006580"
"US","US","P","B2","Method for designing a bone morphology based hip system","A method of designing a group of femoral implants from three-dimensional images of femurs from a patient population greater than 100. A boundary between cortical and cancellous bone is defined in each of the images. A longitudinal axis of the femur is defined centered within the boundary. The width of the boundary is measured in a direction perpendicular to the axis at multiple cross-sections along the longitudinal axis spaced less than 20 mm. At least five (5) different size implants for implantation in a noncortical bone area of the femur are designed based on the measured widths. At least one area of the proximal femoral component boundary is designed where the implant outer surface is sized to be within 2 mm of the cortical bone. The proximal dimensions of the at least five implants are sized to provide the fit within 2 mm in 95% of the femurs from the population.","1. A method of designing a group of femoral implants for implantation into a population of patients comprising: obtaining three-dimensional images of femur from each patient of a population of patients numbering greater than 100;defining a boundary between cortical and cancellous bone in each of the images;defining a longitudinal axis of the femur geometrically centered within the boundary;measuring the width of the boundary in a direction perpendicular to the axis at multiple cross-sections along the longitudinal axis spaced less than 20 mm apart along the longitudinal axis;defining at least five (5) different size implants for implantation in a noncortical bone area of the bone based on the measured widths;defining at least one area of the proximal femoral boundary where the implant outer surface is sized to be within 2 mm on a medial side of the cortical bone; andrevising proximal dimensions of the at least five different size implants to provide the fit of the implants within 2 mm on the medial side in 95% of the femurs from the population further comprising aggregating cross-sectional data from the images to create an average stem profile for each of the at least five different size implants prior to revising the size of each stem to provide the fit within 2 mm of cortical bone proximally.","19","13/358695","2012-01-26","2013-0197866","2013-08-01","8983807","2015-03-17","HOWMEDICA OSTEONICS CORP.","Thies  Wuestemann | Adam  Bastian","","","","A61B-0017/155","A61B-0017/155 | A61F-0002/3859 | A61B-0005/4528","G06F-017/50","G06F-017/50 | A61B-017/15 | A61F-002/38 | A61B-005/00","703/001","703/001","","","","4915012006165"
"US","US","P","B2","Tube verifier","There is provided a tube connector for connecting between a fluid sampling tube and a fluid analyzer, the tube connector includes an end face adapted to identify the tube connector, said end face comprising a reflecting surface having one or more reflective regions adapted to reflect light at a predetermined range of wavelengths.","1. A tube connector, comprising: an end face comprising at least two spectrally distinct reflective regions; andan RFID tag;wherein said at least two spectrally distinct reflective regions are configured to reflect light at different wavelengths; andwherein said at least two spectrally distinct reflective regions are arranged such that a tube connection system of a fluid analyzer can identify recurring changes of reflectivity from said at least two spectrally distinct reflective regions, during the revolving of said tube connector relative to said tube connection system, the revolving occurring after said tube connector is connected to said tube connection system.","10","14/255724","2014-04-17","2014-0252082","2014-09-11","8967461","2015-03-03","ORIDION MEDICAL (1987) LTD.","Joshua Lewis  Colman | Zion  Botesazan | Gal  Itzhak","","","","G06K-0019/07758","G06K-0019/07758 | A61M-0039/10 | B01L-0003/565 | G01N-0035/00732 | G06K-0019/0614 | G06K-0019/06028 | G06F-0017/30 | A61M-0025/0014 | A61M-2039/1044 | A61M-2039/1094 | A61M-2205/276 | A61M-2205/6018 | A61M-2205/6054 | A61M-2205/6063 | A61M-2205/6072 | B01L-2200/143 | B01L-2300/022 | B01L-2300/0627 | B01L-2300/168","G06F-017/00","G06F-017/00 | G06K-007/10 | G06K-019/00 | G06K-019/06 | G06M-007/00 | G01N-009/04 | G01N-021/86 | F21K-002/00 | A61M-025/16 | A61M-025/18 | G06K-015/00 | G06K-019/077 | A61M-039/10 | B01L-003/00 | G01N-035/00 | G06F-017/30 | A61M-025/00","235/375","235/375 | 235/462.01 | 235/487 | 235/492 | 235/493 | 235/454 | 235/462.13 | 340/572.1 | 250/221 | 250/224 | 250/559.3 | 250/465.1 | 604/533 | 604/538","","","","4915010001344"
"US","US","P","B2","Medical data transport over wireless life critical network","A communicator facilitates communications with a remote server via a wireless network supporting a plurality of disparate data transport mechanisms having differing characteristics. A processor coupled to memory is disposed in a communicator housing, which is configured for portability. The memory stores wireless radio firmware and data transfer instructions that are executable by the processor for transferring data to the remote server in accordance with a priority level. The priority level is based in part on criticality of the data and the communicator status. A radio disposed in the housing effects communications via the wireless network in accordance with the firmware. A power source in the housing supplies power for communicator components. The processor executes program instructions for selecting a data transport mechanism among the plurality transport mechanisms based on the priority level, and transmits the data via the wireless network via the radio using the selected transport mechanism.","1. A communicator configured to facilitate communications with a remote server via a wireless network comprising: a processor;memory coupled to the processor, the memory configured to store wireless radio firmware and data transfer instructions, the data transfer instructions executable by the processor for transferring data to a remote server in accordance with a priority level, wherein the priority level is based at least in part on criticality of the data a radio configured to effect communications via the wireless network in accordance with program instructions of the wireless radio firmware executable by the processor; andthe processor configured to execute program instructions for selecting a data transport mechanism among a plurality of disparate data transport mechanisms based at least in part on the priority level and transmitting the data via the wireless network to the remote server using the selected transport mechanism via the radio.","18","14/071893","2013-11-05","2014-0062718","2014-03-06","8970392","2015-03-03","Cardiac Pacemakers, Inc.","John  LaLonde | William R.  Mass | Kenneth P.  Hoyme | David C.  Johnson | Joseph E.  Bange | Mark  Gryzwa","","","","A61B-0005/0026","A61B-0005/0026 | A61N-0001/37282 | G06F-0019/3418 | G06Q-0050/24 | G08C-0017/02 | A61N-0001/37211 | G06F-0019/327 | G06F-0019/3412 | H04L-0067/12","G08C-019/16","G08C-019/16 | A61B-005/00 | A61N-001/372 | G06F-019/00 | G06Q-050/24 | G08C-017/02 | H04L-029/08","340/870.01","340/870.01","","","","4915010004256"
"US","US","P","B2","Method and process for semantic or faceted search over unstructured and annotated data","A semantic query over a corpus of data is constructed using a graphical user interface to create an aggregation of graphical representations of annotations associated with a plurality of data elements contained within the corpus of data and graphical representations of search terms contained within the plurality of data elements. The aggregation includes at least one annotation and at least one search term. The relative positions of the graphical representations of the annotations and the search terms are manipulated within the aggregation within the graphical user interface to express relationships among the annotations and search terms, yielding a visual spatial representation of the semantic query. The annotations, search terms and expressed relationships define the semantic query that is used to search the corpus of data.","1. A method for constructing a semantic query over a corpus of data, the method comprising: using a graphical user interface to create an aggregation of graphical representations of annotations associated with a plurality of data elements contained within the corpus of data and graphical representations of search terms contained within the plurality of data elements, wherein the aggregation comprises at least one annotation and at least one search term;manipulating relative positions of the graphical representations of the annotations and the search terms within the aggregation within the graphical user interface to express relationships among the annotations and search terms, the annotations, search terms and expressed relationships defining the semantic query; andsearching the corpus of data using the defined semantic query.","17","13/926582","2013-06-25","2013-0290370","2013-10-31","8972440","2015-03-03","INTERNATIONAL BUSINESS MACHINES CORPORATION","Branimir Konstantinov  Boguraev | Eric William  Brown | Youssef  Drissi | David Angelo  Ferrucci | Paul Turquand  Keyser | Anthony Tom  Levas | Dafna  Sheinwald","","","","G06F-0017/30979","G06F-0017/30979 | G06F-0017/30398 | G06F-0017/30277 | G06F-0003/048 | A61B-0005/00 | G06F-0019/325 | G06F-0019/3443 | G06F-0019/345 | G06F-0019/363 | G06Q-0050/22","G06F-007/76","G06F-007/76 | G06F-017/30 | G06F-003/048 | A61B-005/00 | G06F-019/00 | G06Q-050/22","707/769","707/769 | 707/713","","","","4915010006292"
"US","US","P","B2","Visual input of vehicle operator","The present invention relates to a method for determining a vehicle operator's visual input of an object in the operator's surroundings, which method comprises receiving an object position signal indicative of the position of at least one object, receiving an operator motion input signal indicative of operator physiological data comprising information relating to body motion of the operator, estimating an operator eye-gaze direction, and determining a visual input quality value representative of level of visual input of the at least one object received by the operator, based on the object position signal and the estimated operator eye-gaze direction.","1. A method for determining a vehicle operator'ss visual input of an object in the operator'ss surroundings, the method comprising: receiving an object position signal indicative of a position of at least one object in the operator'ss surroundings;receiving an operator motion input signal indicative of physiological data comprising information relating to at least one of eye, face, head and body motion of the operator of the vehicle;estimating an operator eye-gaze direction based on the operator motion input signal;estimating an expected fixation probability indicative of a probability of fixation of the object by the operator'ss eyes; anddetermining a visual input quality value representative of a level of visual input of the at least one object received by the operator, based on the object position signal, the estimated operator eye-gaze direction, and the estimated expected fixation probability.","16","13/601789","2012-08-31","2013-0058529","2013-03-07","8965037","2015-02-24","VOLVO TECHNOLOGY CORPORATION | VOLVO CAR CORPORATION","Daniel  Levin | Gustav  Markkula","2011-179817","EP","2011-09-02","B60K-0028/066","B60K-0028/066 | A61B-0003/113 | A61B-0005/18 | G06F-0003/013","G06T-007/00","G06T-007/00 | B60W-050/14 | B60K-028/06 | A61B-003/113 | A61B-005/18 | G06F-003/01","382/100","382/100 | 382/103","","","","4915009005882"
"US","US","P","B2","Patient customized therapeutic regimens","Methods, systems and compositions that allow for treating a patient according to a patient customized therapeutic regimen are provided. Embodiments of the invention include obtaining dosage administration information from a patient and using the same to tailor a therapeutic regimen for the patient. Embodiments of the invention further include preparing and forwarding to the patient physical pharmaceutical dosages based on the customized therapeutic regimen.","1. A method of managing a therapeutic regimen for treatment of a patient, the therapeutic regimen specifying a pharmaceutical dosage of the medical composition and a dosing schedule, the method comprising: receiving confirmatory data from a first device associated with a patient at a second device associated with a body of the patient when the first device is ingested by the patient and is activated upon contact with an electrically conductive body fluid via completion of a partial power source, wherein the first device is electrically coupled to the body of the patient, wherein the confirmatory data represents actual ingestion of the pharmaceutical dosage of the medical composition by the patient, and wherein the confirmatory data is produced by the first device and is transmitted to the second device;receiving at the second device physiological data indicating a response of the patient to the pharmaceutical dosage of the medical composition, wherein the second device is electrically coupled external to the body of the patient;evaluating the confirmatory data and the physiological data to determine when a change in the therapeutic regimen is desired; andmodulating the therapeutic regimen when the change is determined to be desired, wherein modulating the therapeutic regimen comprises changing at least one of the pharmaceutical dosage of the medical composition and the dosing schedule based on the evaluation of the confirmatory data and the physiological data.","39","12/299303","2007-05-02","2009-0076338","2009-03-19","8956287","2015-02-17","PROTEUS DIGITAL HEALTH, INC.","Mark J.  Zdeblick | Andrew  Thompson | George M.  Savage","","","","G06F-0019/3456","G06F-0019/3456 | A61B-0005/073 | A61B-0005/0028 | A61B-0005/0002 | H04B-0013/005 | A61B-0005/4833 | G06F-0019/3418 | G06F-0019/3475 | H01M-0008/02 | G06Q-0010/00 | G06Q-0050/22 | H01M-2220/10 | Y10S-0128/92 | Y10S-0128/903","G06Q-050/00","G06Q-050/00 | A61B-005/00 | A61B-005/07 | H01M-008/02 | G06Q-010/00 | G06Q-050/22 | G06F-019/00 | H04B-013/00 | H01M-008/00","600/300","600/300 | 705/002 | 705/003 | 128/920 | 128/903 | 340/870.07 | 340/539.12 | 340/573.1 | 424/009.1 | 424/408 | 429/498 | 600/302 | 600/372","","","","4915008001456"
"US","US","P","B2","Lifestyle companion system","Methods and systems for providing a lifestyle companion system are provided. The lifestyle companion system can provide a platform to conduct a user interview. Based on the user interview responses, the system can suggest activities, references, and/or plug-in modules. During performance of activities, the system can provide audio and/or visual cues related to the activities and collect data indicative of the user's performance. Based on the collected data, the system can dynamically adapt the user's goals and/or activities the user is performing or will perform. In some embodiments of the present invention, the lifestyle companion system of the present invention can be applied to fitness, nutrition, and/or medical modules. The system also can be used to facilitate synchronous group activities.","1. A portable electronic device for assisting a user in planning a fitness regiment, the portable electronic device comprising: a display;memory; andat least one controller configured to: conduct an interview;store a user profile in the memory based on interview responses;identify multiple suggested fitness activities from a database of fitness activities based on the interview responses;provide data for graphics indicative of the multiple suggested fitness activities on the display; andpermit a user to select at least two of the multiple suggested fitness activities to compose a workout compilation, wherein the at least one controller is configured to select at least a first suggested fitness activity of the multiple suggested fitness activities by randomly selecting the first suggested fitness activity from a subset of the database of fitness activities, wherein the at least one controller is configured to select the subset of the database of fitness activities based on the interview responses, wherein the at least one controller is further configured to select at least one entertainment media file for association with the multiple suggested fitness activities, wherein each entertainment media file of the at least one entertainment media file has an energy rank based on energy level, and wherein the at least one controller is configured to select the at least one entertainment media file based on expected intensity levels of the multiple suggested fitness activities and the energy level of each entertainment media file of the at least one entertainment media file.","12","11/729172","2007-03-27","2008-0086318","2008-04-10","8956290","2015-02-17","APPLE INC.","Glenn Gregory  Gilley | Sarah A.  Brody | Randall Hayes  Ubillos | Mihnea Calin  Pacurariu | Jesse Lee  Dorogusker | Robert Edward  Borchers | Donald  Ginsburg","","","","G06Q-0010/109","G06Q-0010/109 | G06F-0019/3456 | G06F-0019/366 | A63B-0024/0075 | A63B-0024/0062 | G06Q-0050/22 | G06Q-0010/06 | G06Q-0050/01 | G06F-0019/3475 | G06F-0019/3481 | A63B-2024/0068 | Y10S-0128/92 | Y10S-0128/921","G06Q-010/00","G06Q-010/00 | G06Q-030/00 | G06Q-010/10 | G06Q-050/22 | G06Q-010/06 | G06Q-050/00 | G06F-019/00 | A61B-005/00 | A63B-024/00","600/301","600/301 | 600/300 | 705/002 | 705/003 | 482/003 | 482/009 | 482/008 | 128/920 | 128/921","","","","4915008001459"
"US","US","P","B2","Remote surveillance system","A method is provided for a system including a plurality of remote sensor apparatus and a portable receiver. The portable receiver includes an RFID reader. The remote sensor apparatus has an RFID unit. The method includes reading RFID stored in the RFID unit of one or more of the plurality of remote sensor apparatus using the RFID reader. The method also includes registering the one or more of the plurality of remote sensor apparatus using the received RFID. The method further includes receiving data from a first active remote sensor apparatus. The data includes sensor data collected from sensors installed in the first active remote sensor and RFID of the first active remote sensor apparatus. The method also includes processing the sensor data, if the RFID of the first active remote sensor apparatus matches the RFID of any of the one or more of the plurality of remote sensor apparatus.","1. In a surveillance system including a plurality of remote sensor apparatus that each is configured for collecting data and a portable receiver for receiving data collected by one or more of the plurality of remote sensor apparatus, wherein the portable receiver includes a radio-frequency identification (RFID) reader and is capable of running an application program for processing the received data and displaying the processed data on a display screen of the portable receiver and wherein the remote sensor apparatus has a housing for containing a processing unit, a plurality of sensors coupled to the processor, an RFID unit and a wireless transceiver, a method for registering one or more of the plurality of remote sensor apparatus with the portable receiver, the method comprising: reading, at the portable receiver, radio-frequency identification (RFID) stored in the RFID unit of one or more of the plurality of remote sensor apparatus using the RFID reader;registering, at the portable receiver, the one or more of the plurality of remote sensor apparatus using the received RFID;receiving, at the portable receiver, first data from a first active remote sensor apparatus, wherein the received first data includes first sensor data collected from at least one of a first plurality of sensors installed in the first active remote sensor and RFID of the first active remote sensor apparatus; andprocessing, at the portable receiver, the first sensor data received from the first active remote sensor apparatus, if the RFID of the first active remote sensor apparatus matches the RFID of any of the one or more of the plurality of remote sensor apparatus.","9","13/801627","2013-03-13","2014-0266773","2014-09-18","8957783","2015-02-17","BOUNCE IMAGING, INC.","Francisco  Aguilar | Pablo  Alvarado-Moya | Mikhail  Fridberg","","","","G08C-0017/02","G08C-0017/02","G08C-019/16","G08C-019/16 | G08C-017/02 | H04N-005/228 | H04N-007/18 | G06Q-040/00 | A61B-005/00 | G06K-009/00 | G06F-007/04","340/870.01","340/870.01 | 348/222.1 | 348/143 | 705/043 | 600/300 | 382/103 | 726/004","","","","4915008002942"
