"US","US","P","B2","Medical instrument management support apparatus for supporting scope management","The examination schedule memory unit stores an examination schedule including the starting time and the ending time of each examination. A cleaning capacity memory unit stores cleaning-capacity information that specifies the cleaning capacity of cleaning apparatuses that clean a scope used for the examination. A cleaning schedule generation unit generates a cleaning schedule for cleaning a used scope produced at the end of each examination with cleaning apparatuses having a cleaning capacity required by the cleaning-capacity information stored in the cleaning capacity memory unit. The scope shortage determination unit determines whether or not there will be a shortage of scopes to be used for each examination in accordance with both the examination starting time specified by the above examination schedule and the cleaning ending time specified by the cleaning schedule.","1. A medical instrument management support apparatus, the apparatus comprising: an endoscopic examination schedule memory unit operative to store an endoscopic examination schedule including the starting time and the ending time of each endoscopic examination;a cleaning capacity memory unit operative to store the number of operable cleaning apparatuses among a plurality of cleaning apparatuses that clean an endoscope used for the endoscopic examination;a processor; anda memory storing computer readable instructions that, when executed by the processor, implement:a cleaning schedule generation unit operative to generate, in accordance with an endoscopic examination schedule stored in the endoscopic examination schedule memory unit, a cleaning schedule for cleaning a used endoscope produced at the end of each endoscopic examination, with as many cleaning apparatuses as the number of operable cleaning apparatuses stored in the cleaning capacity memory unit; andan endoscope shortage determination unit operative to determine whether or not there will be a shortage of endoscopes to be used for each endoscopic examination in accordance with both the endoscopic examination starting time specified by the endoscopic examination schedule and the cleaning ending time specified by the cleaning schedule, whereinthe endoscope shortage determination unit determines whether or not there will be a shortage of endoscopes by simulating the transition of the number of usable endoscopes that decreases upon the start of each endoscopic examination and increases upon the completion of cleaning the used endoscope in accordance with the cleaning schedule, wherein the number of cleaned endoscopes stored in a facility where the endoscopic examination is performed is set to be the initial value,the cleaning schedule generation unit sets, when there is an available cleaning apparatus among cleaning apparatuses that are operable at the ending time of the endoscopic examination, the ending time of a cleaning of a used endoscope produced at the end of the endoscopic examination to the time obtained by adding the cleaning time of the cleaning apparatus to the ending time of the endoscopic examination, and sets, when all the cleaning apparatuses that are operable at the ending time of the endoscopic examination are in the process of cleaning, the cleaning ending time of a used endoscope produced at the end of the endoscopic examination to the time obtained by adding the cleaning time of a cleaning apparatus whose cleaning finishes the earliest to the cleaning ending time of the cleaning apparatus, andthe endoscope shortage determination unit decreases the number of the usable endoscopes at the starting time of each of the endoscopic examinations, increases the ending time of cleaning the used endoscope, and determines that there will be a shortage of endoscopes when the number of the usable endoscopes goes below zero in the endoscopic examination schedule.","8","12/533878","2009-07-31","2010-0030573","2010-02-04","8768721","2014-07-01","OLYMPUS MEDICAL SYSTEMS CORP.","Hiroyuki Araki | Tatsuya Shiobara | Chieko Watanabe | Nobuaki Matsubara | Kazuhiro Akiyama | Hidenori Tsuruma | Tasuku Ogawa","2008-198649","JP","2008-07-31","","","G06Q-010/00","G06Q-010/00 | G06Q-050/00 | A61B-005/00 | G06F-019/00","705/002","705/002 | 705/003","","","","4914026006078"
"US","US","P","B1","Method, system, and computer program product for physician efficiency measurement and patient health risk stratification utilizing variable windows for episode creation","A method for measuring physician efficiency and patient health risk stratification is disclosed. Episodes of care are formed from medical claims data and an output process is performed. Physicians are assigned to report groups, and eligible physicians and episode assignments are determined. Condition-specific episode statistics and weighted episode statistics are calculated, from which physician efficiency scores are determined.","1. A method implemented on a computer system of determining physician efficiency, the method comprising: obtaining medical claims data stored in a non-transitory computer readable medium on the computer system;performing patient analysis using said obtained medical claims data to form episodes of care utilizing the computer system;assigning complete (non-partial) episodes of care to physicians utilizing an assignment rule that allows assignment of an episode of care to more than one physician;assigning at least one physician to a report group based on geographic area designation utilizing the computer system, each physician assigned to no more than one report group;determining eligible physicians and episode of care assignments utilizing the computer system;calculating condition-specific episode of care statistics utilizing the computer system;calculating weighted episode of care statistics across medical conditions utilizing a predefined set of medical conditions for a specific specialty type utilizing the computer system; anddetermining efficiency scores for physicians from said calculated condition-specific episode of care statistics and said weighted episode of care statistics calculated across medical conditions utilizing the computer system.","19","13/794765","2013-03-11","","","8768726","2014-07-01","Cave Consulting Group, Inc.","Douglas G  Cave","","","","","","G06Q-010/00","G06Q-010/00 | G06Q-050/00 | A61B-005/00 | G06F-019/00","705/002","705/002 | 705/003","","","","4914026006083"
"US","US","P","B2","Medical value index","The present invention incorporates medical knowledge into the processes and algorithms that combine inpatient quality outcomes, ambulatory quality measures and health insurers' financial data into a Medical Value Index (MVI) which forms actionable information that hospitals and physicians can use to improve the efficacies and efficiencies of their care. It then quantifies the financial net savings that predictably accrue as a result of the providers' improved medical outcomes. This MVI information enables a hospital or health insurer to equitably share the net saving with the physicians and hospitals as incentives to continuously improve the quality of their patients' care and control costs.","1. A computer implemented, web-based method for calculating a medical value index of healthcare performance measurement for one or more healthcare providers comprising: (a) searching one or more computer databases and one or more computer network memory for medical information from hospital patients charts data, hospital medical records and hospital department data, insurance company data government data and physician'ss office data;(b) gathering, compiling and aggregating said medical information from hospital patient charts data, hospital medical records and hospital department data, insurance company data, government data and physician'ss office data wherein said aggregation of data includes the use of a Sherlock computer program sub-system and memory database which targets cases by type, physician, severity and clinical services, diagnoses and procedures at a revenue code level, and use of resources;(c) using the aggregated gathered compiled data or calculating the following quality metric scores: (i) Quality Measures and Patient Satisfaction (QMPS);(ii) Composite Re-Admission Rate (RADM);(iii) Risk Adjusted Mortality Rate (MORT);(iv) Risk Adjusted Morbidity Rate (MORB);(v) Reduction In Variation (RIV); and(vi) Resource Consumption (RESC);wherein said Sherlock computer sub-system aggregated data is further analyzed by a Verras Watson based computer sub-system which explains diagnoses and procedures by whom by specific physician, what and win, sequence of events, and what was not documented, explains specific resources by specific type of tests, breakdown of drugs, identifies why extra days were spent in hospital, and converts charges to true costs, and creates a best practices framework by database of clinical variation by diagnosis and procedure, establishes a computerized physician order entry (CPOE) customization and facilitates clinical pathway construction; and(d) calculating a medical value index (MVI) for each healthcare provider by adding the quality metric scores for each of the six metrics.","15","14/017919","2013-09-04","2014-0081664","2014-03-20","8762169","2014-06-24","Verras Healthcare International, LLC","William C.  Mohlenbrock | Timothy M.  Breen","","","","","","G06Q-010/00","G06Q-010/00 | G06Q-050/00 | A61B-005/00 | G06F-019/00","705/002","705/002 | 705/003","","","","4914025005950"
"US","US","P","B2","Medical information management system and management apparatus","In a monitor device, an input unit inputs patient identification information, an information acquiring unit acquires state information on a state of a patient, and a transmission unit transmits the patient identification information and the state information to a management apparatus. In the management apparatus, biological information acquiring unit acquires the patient identification information, the state information, and identification information on the monitor device. A determination unit determines, when the acquired patient identification information and that stored in a storage device match each other, whether the acquired device identification information and the device identification information mapped to the location information stored in the storage device are the same as each other. When they are the same as each other, a storage management unit stores the acquired state information by associating it with the patient identification information stored in the storage device.","1. A medical information management system comprising: a management apparatus operative to manage information on medical practice for a patient; anda device able to communicate with the management apparatus via a network, whereinthe device includes:an input unit operative to input patient identification information;a first acquiring unit operative to acquire state information on a state of a patient; anda transmission unit operative to transmit the patient identification information and the state information, and whereinthe management apparatus includes:a second acquiring unit operative to acquire the patient identification information, the state information, and identification information on the device;a holding unit operative to hold both location information for specifying a location where medical practice is executed and identification information on a device installed in the location, by mapping them to each other;a storage unit operative to store execution information on medical practice for a patient by mapping it to the patient identification information and the location information for specifying a location where medical practice has been executed;a determination unit operative to determine, when the patient identification information acquired by the second acquiring unit matches the patient identification information stored in the storage unit, whether the device identification information acquired by the second acquiring unit is the same as the device identification information mapped to the location information stored in the storage unit; anda storage management unit operative to store, when it is determined that both the device identification information are the same as each other, the state information acquired by the second acquiring unit in the storage unit by associating it with the patient identification information.","5","13/858982","2013-04-09","2013-0297343","2013-11-07","8756081","2014-06-17","OLYMPUS MEDICAL SYSTEMS CORP.","Koichi  Hirose | Hirofumi  Inaba | Koji  Suzuki","2011-224301","JP","2011-10-11","","","G06Q-010/00","G06Q-010/00 | G06Q-050/00 | A61B-005/00 | G06F-019/00","705/003","705/003 | 705/002","","","","4914024004277"
"US","US","P","B2","Signal processing for predicting an input time series signal and application thereof to predict position of an affected area during radiotherapy","A certain component of an input time series signal (hereinafter referred to as input) is assumed as a cycle time-variable time series signal and a prediction model for predicting a value of the input after the predetermined time is produced, and the value of the input after the predetermined time is predicted and outputted using the prediction model.","1. A radiotherapy apparatus for irradiating a radiation on an affected area of a patient, the radiotherapy apparatus comprising: a radiation generator configured to generate the radiation;a measure configured to measure a position of the affected area; anda signal processing apparatus comprising: a cycle fluctuation analyzer configured to assume an input time series signal, which represents values at respective time points until a first time point, as a time series signal whose cycle length, which is a length of a cycle, varies with respect to time to carry out a correlation analysis between part of the input time series signal and the input time series signal, calculate multiple cycle lengths, which are respectively at different time points, as a cycle length fluctuation of the input time series signal and reliability of the cycle length fluctuation using a result of the correlation analysis, predict a cycle length of the time series signal until a second time point after the first time point using the cycle length fluctuation and the reliability of the cycle length fluctuation and calculate, using the result of the correlation analysis and the predicted cycle length, in-phase time information, which represents a time point before the second time point in the input time series signal, and reliability of the in-phase time information, a phase at the time point in the input time series signal becoming same as a phase at the second time point in the time series signal;a prediction accuracy estimator configured to estimate model design information for predicting a value of the time series signal at the second time point and accuracy of the prediction of the value of the time series signal at the second time point using the input time series signal, the time series information of a variation per unit time of the value and the in-phase time information and the reliability of the in-phase time information calculated by said cycle fluctuation analyzer, the accuracy being based on the estimated model design information; anda model producer configured to produce, using the input time series signal, the in-phase time information and the reliability of the in-phase time information calculated by said cycle fluctuation analyzer and the model design information estimated by said prediction accuracy estimator, a prediction model for predicting the value of the time series signal at the second time point and predict and output the value of the time series signal at the second time point using the prediction model, whereinsaid signal processing apparatus is adapted to predict a position of the affected area at the second time point and estimate accuracy information of the prediction position using, as the input time series signal, a time series signal regarding the position of the affected area measured by said measure.","14","13/112361","2011-05-20","2011-0266464","2011-11-03","8751200","2014-06-10","TOHOKU UNIVERSITY","Yoshihiro  Takai | Noriyasu  Homma | Masao  Sakai","2008-298634","JP","2008-11-21","G06F-0017/153","G06F-0017/153 | A61N-0005/1037","G06F-017/15","G06F-017/15 | A61N-005/10","703/002","703/002 | 378/065 | 708/426","","","","4914023005933"
"US","US","P","B2","System and method for capture of qualified compliance data at point of clinical care","A system and related techniques generate and maintain a set of compliance-qualified data schemas or templates for deployment in a hospital or other clinical setting. According to conventional implementations, the clinical data required by regulatory reporting bodies such as CMS (Centers for Medicare and Medicaid Services), JCAHO (Joint Commission on Accreditation of Healthcare Organizations) or other government or private bodies may not be systematically captured or track, so that compliance officers and other managers are left to reconstruct compliance data after the face, for instance from patient accounting systems or other platforms not designed to filter or store regulatory data. Platforms and methods according to the invention, in contrast, may access regulatory or compliance criteria and generate a data capture or documented care template, according to which various clinical measures and other information which are required by compliance bodies are automatically captured, at the point of care. Thus patient labs, tests, outcomes and other clinically related data may be conditioned to include that information demanded by regulatory standards, including lab ratios and others, and that data may be automatically recorded, stored, and in embodiments, transmitted to regulatory bodies or agencies, electronically. The regulatory data store that results may likewise in embodiments be accessed by analytic tools to model various compliance and clinical scenarios.","1. One or more computer readable storage media having computer executable instructions embodied thereon that, when executed by a computing device, perform a method for capturing compliance-qualified data, the method comprising: receiving a set of identifying information associated with a patient at a point of care;accessing patient information indicating membership of the patient in a group chosen from the set consisting of: an insurer, private payor, public payor, federal payor, Medicaid payor, and Medicare payor; anddetermining whether the patient lies within a population for which capture of compliance data is mandated by the patient'ss group, wherein: upon determining that the patient lies within a population for which capture of compliance data is not mandated by the patient'ss group: ending compliance processing automatically, thereby preventing creation of a list of one or more items that require attention to meet compliance reporting requirements;preventing the generation of an alert of the one or more items that require attention; andpreventing a quality analysis of the alert of the one or more items that require attention; and wherein;upon determining that the patient lies within a population for which capture of compliance data is mandated by the patient'ss group: accessing a set of group-indicated compliance requirements relevant to the patient based on the indicated patient group and the required compliance data;generating a documented care template based on the set of group-indicated compliance requirements;capturing a set of compliance-qualified data based on the set of group-indicated compliance requirements included in the documented care template at the point of care;creating from a set of group-indicated compliance requirements a list of one or more items that require attention to meet compliance reporting requirements; andgenerating an alert of the one or more items that require attention consisting of one or more of: an indicator, a user-interface element, a flag, a dialog box, and a problem description, from said list.","34","11/025998","2005-01-03","2006-0149590","2006-07-06","8751249","2014-06-10","CERNER INNOVATION, INC.","Patricia A.  Palmer | Karen S.  Berg","","","","","","G06Q-010/00","G06Q-010/00 | G06Q-050/00 | A61B-005/00 | G06F-019/00","705/002","705/002 | 705/003","","","","4914023005982"
"US","US","P","B2","Inspection room decision support system, inspection room decision support method and computer readable medium","An inspection room decision support system for providing support in deciding one inspection room in which a requested endoscopic inspection will be conducted, plural inspection rooms, the system includes: an input unit that inputs information; a registration unit that registers at least information about each of the inspection rooms, information about a number of persons waiting for inspection in each of the inspection rooms and information about an endoscope used in each of the inspection rooms into a database in accordance with the information inputted by the input unit; and a control unit which reads at least the information about each of the inspection rooms, the information about the number of persons waiting for inspection in each of the inspection rooms and the information about the endoscope in each of the inspection rooms from the database, and makes a display device display these pieces of information associated with each other.","1. An inspection room decision support system for providing support in deciding one inspection room in which a requested endoscopic inspection will be conducted, from a plurality of inspection rooms, the system comprising: an input unit that inputs information;a registration unit that registers at least information about each of the inspection rooms, information about a number of persons waiting for inspection in each of the inspection rooms, information about the number of inspected persons in each of the inspection rooms and information about an endoscope used in each of the inspection rooms into a database in accordance with the information inputted by the input unit; anda control unit as a processor, which reads at least the information about each of the inspection rooms, the information about the number of persons waiting for inspection in each of the inspection rooms, the information about the number of inspected persons in each of the inspection rooms and the information about the endoscope in each of the inspection rooms from the database, and makes a display device display these pieces of information associated with each other by using icons for the inspection rooms,wherein one of the icons for one of the inspection rooms provides;the information about the number of persons waiting for inspection in the one of the inspection rooms on one of right and left sides inside the one of the icons, andthe information about the number of inspection persons on the one of the inspection rooms on the other of right and left sides inside the one of the icons, andthe information about the endoscope in each of the inspection rooms on a lower side of the information about the number of persons waiting for inspection and the information about the number of inspected persons inside the one of the icons.","33","12/894270","2010-09-30","2011-0077960","2011-03-31","8751258","2014-06-10","FUJIFILM CORPORATION","Takayoshi  Kiuchi | Ryojiro  Sasage | Kunimasa  Shimizu | Goro  Miura | Koichiro  Miyazaki | Shinichi  Shidara | Yasuhiro  Asai","2009-228666 | 2010-195230","JP | JP","2009-09-30 | 2010-08-31","","","G06Q-050/00","G06Q-050/00 | G06F-019/00 | A61B-005/00 | G06Q-010/00","705/002","705/002 | 705/003","","","","4914023005991"
