"US","US","P","B2","Personal authentication method and personal authentication device utilizing ocular fundus blood flow measurement by laser light","A personal authentication method comprising imaging, on an image sensor as a laser speckle using an optical system, light reflected from retinal blood vessels of the ocular fundus and a blood vessel layer in ocular fundus internal tissue when a laser beam is expanded and made to irradiate the ocular fundus, calculating a quantity that represents the rate of change with respect to time of the amount of light received for each pixel of the laser speckle, obtaining an ocular fundus blood flow map as a two-dimensional map of the numerical values of the quantity, and comparison-checking against pre-registered personal data utilizing at least one, observed in the blood flow map, of blood flow distribution data, a pattern reflecting the course of retinal blood vessels, a pattern reflecting the course of blood vessels in ocular fundus internal tissue observed superimposed thereon, and data on changes thereof over time, and a device therefor. In accordance with the method and device of the present invention utilizing the ocular fundus blood flow rate map, a personal authentication method and device can be obtained that have remarkably higher accuracy than conventional methods and devices.","1. A personal authentication method comprising imaging, on an image sensor as a laser speckle using an optical system, light reflected from retinal blood vessels of the ocular fundus and a blood vessel layer in ocular fundus internal tissue when a laser beam is expanded and made to irradiate the ocular fundus, calculating a quantity that represents the rate of change with respect to time of the amount of light received for each pixel of the laser speckle, obtaining an ocular fundus blood flow map as a two-dimensional map of numerical values of the quantity, and comparison-checking the blood flow map against pre-registered personal data, wherein the blood flow map obtained from reflected light is measured using a laser beam that can reach the internal tissue of the ocular fundus, and comparison-checking against pre-registered personal data is carried out utilizing at least one, observed in the blood flow map, of blood flow distribution data, a pattern reflecting the course of retinal blood vessels, a pattern reflecting the course of blood vessels in ocular fundus internal tissue observed superimposed thereon, and data on change thereof over time.","15","12/303461","2007-05-28","2009-0202113","2009-08-13","8285003","2012-10-09","KYUSHU INSTITUTE OF TECHNOLOGY | SYSCOM JAPAN, INC.","Hitoshi Fujii | Naoki Konishi","2006-158542","JP","2006-06-07","","","G06K-009/00","G06K-009/00 | A61B-005/00 | A61B-005/02","382/117","382/117 | 382/128 | 600/310 | 600/504","","","","4912041004009"
"US","US","P","B2","Method for remote medical consultation and care","A method for remote medical consulting includes collecting diagnostic data using at least one wearable device contoured to at least a portion of a person's hand, transmitting the diagnostic data to a remote location, transmitting audio data and video images of the patient to the remote location, and communicating diagnosis and/or treatment information to the patient based at least in part on the diagnostic data. The treatment information may include a prescription electronically transmitted to the patient or a pharmacy. The method includes billing of the patient via credit or debit card, bank account, or a third party, such as an insurance company. The diagnostic data as well as the audio and video data may be transmitted wirelessly via cellular or satellite communication networks and/or using a wide area computer network such as the internet.","1. A method for remote medical consulting between a patient and medical personnel, the method comprising: collecting identification information from the patient;wearing at least one wearable device on a hand, the at least one wearable device including at least one diagnostic device for generating signals in response to corresponding characteristics of the patient when positioned over a portion of the patient'ss body other than hands of the patient;positioning the wearable device over a portion of the patient'ss body other than hands;collecting diagnostic data, via the at least one wearable device worn on the hand, from the portion of the patient'ss body other than the hands of the patient over which the wearable device is positioned;transmitting the diagnostic data generated using the at least one wearable device to a remote location; andcommunicating diagnosis and/or treatment information to the patient based at least in part on the diagnostic data.","35","12/977654","2010-12-23","2011-0092825","2011-04-21","8285560","2012-10-09","Ineedmd.com, Inc.","Govindan Gopinathan | Arthur R. Tilford | Michael Makover","","","","","","G06Q-010/00","G06Q-010/00","705/002","705/002 | 705/003 | 600/300","","","","4912041004563"
"US","US","P","B2","Patient medical parameter trend indicative user interface display system","A system according to invention principles advantageously automatically displays a parameter value within the closest Flowsheet parameter acquisition time interval column. A user interface system provides patient medical parameter data for trend indicative display covering a time period comprising user selectable acquisition time intervals. The system includes an acquisition processor for acquiring, from a patient monitoring device, data representing a patient parameter comprising a plurality of data values at a corresponding plurality of different times within multiple user selectable patient parameter acquisition intervals of a time period. The data processor determines for a particular user selectable acquisition time interval a patient parameter data value closest in time to a center time point of the particular user selected acquisition time interval and excludes other patient parameter data values acquired within the particular user selectable acquisition time interval. A generator generates data representing an image showing a trend indicative display of the patient parameter including the determined patient parameter data value associated with the particular user selectable acquisition time interval and omits the excluded data values.","1. A system for providing patient medical parameter data for trend indicative display covering a time period comprising user selectable acquisition time intervals, comprising: an acquisition processor for, receiving user entered data identifying an acquisition time interval duration, andacquiring data representing a patient parameter using a patient monitoring device having at least one patient connected sensor, the data representing the patient parameter comprising a plurality of data values at a corresponding plurality of different times within multiple patient parameter acquisition time intervals individually having said duration; anda data processor for determining, for said multiple patient parameter acquisition time intervals having said duration, patient parameter data values closest in time to substantial centre time points of said multiple patient parameter acquisition time intervals and for excluding other patient parameter data values acquired within said multiple patient parameter acquisition time intervals.","15","10/411950","2003-04-11","2004-0002874","2004-01-01","8286088","2012-10-09","DRAEGER MEDICAL SYSTEMS, INC.","Judith Shaffer | Mark Penny | Rand J. Monteleone | Amy M. Manetta | Jolyn Rutledge","","","","","","G06F-003/048","G06F-003/048 | G06F-017/21 | G06F-017/00 | G06Q-010/00 | G08B-023/00","715/764","715/764 | 705/002 | 705/003 | 340/573.1","","","","4912041005087"
"US","US","P","B2","Maternal-fetal monitoring system","A maternal-fetal monitoring system for use during all stages of pregnancy, including antepartum and intrapartum stages. The maternal-fetal monitoring system of the subject invention comprises (1) a set of sensors; (2) an amplifying/filtering means; (3) a computing means; and (4) a graphical user interface. Accurate clinical data, which can be extracted and provided to the user in real-time using the system of the invention, include without limitation, maternal electrocardiogram (ECG) signals, maternal uterine activity signals (EHG), maternal heart rate, fetal ECG signals, and fetal heart rate. In a preferred embodiment, the maternal-fetal monitoring system of the invention includes an intelligence means, such as a neural network system, to analyze and interpret clinical data for use in clinical diagnosis antepartum, intrapartum and postpartum, as well as delivery strategy.","1. A maternal-fetal monitoring system comprising: a) at least two surface sensors to receive a mixture of maternal and fetal vital signals, wherein the mixture of maternal and fetal vital signals comprises at least one EHG signal; andb) a computing means for analyzing the mixture of maternal and fetal vital signals from the sensors, said computing means including hardware and software, wherein said software comprises a means for converting the at least one EHG signal directly into montevideo units without first calculating an intrauterine pressure curve.","17","11/140057","2005-05-27","2005-0267377","2005-12-01","8275451","2012-09-25","UNIVERSITY OF FLORIDA RESEARCH FOUNDATION, INC. | CONVERGENT ENGINEERING, INC.","Dorothee Marossero | Tammy Y. Euliano | Neil Russell Euliano, II | Jose C. Principe","","","","","","A61N-001/00","A61N-001/00 | A61B-005/04","600/511","600/511 | 600/513 | 607/018 | 607/023","","","","4912039003813"
"US","US","P","B2","Method and apparatus for assessment of bone age using ultrasound","A method and apparatus for controlling access of individuals to a service, device or location in order to restrict access to members of a particular age and/or gender category, by machine-sensing a predetermined biometric characteristic of the individual indicative of the particular age and/or gender category, and utilizing the machine-sensed characteristic for automatically controlling access of the individual. The method and apparatus are particularly suited to controlling access of children to certain Internet sites, TV programs, chat rooms, or other places inappropriate to children.","1. A method of assessing the bone age of an individual for controlling access of the individual to a service, a device, or a location, comprising: sensing a degree of ossification of an examined bone of the individual by using a through-transmission ultrasound technique to transmit an ultrasound wave transversely through said examined bone and measuring a parameter of the sound velocity of said ultrasound wave, wherein said degree of ossification of the bone of the individual is determined by sensing the presence, absence, or thickness of a bone growth-plate in the examined bone.","13","12/098611","2008-04-07","2008-0214935","2008-09-04","8267866","2012-09-18","Shmuel Levin","Shmuel Levin","","","","","","A61B-008/00","A61B-008/00","600/438","600/438 | 600/448 | 600/449 | 600/437","","","","4912038001602"
"US","US","P","B2","Computerized medical self-diagnostic and treatment advice system including modified data structure","A system for providing computerized, knowledge-based medical diagnostic and treatment advice. The medical advice is provided to the general public over a digital network via interactive dialogue. Software authoring languages, interactive voice response and speech recognition are used to enable expert and general practitioner knowledge to be encoded for access by the public. ""Meta"" functions for time-density analysis of a number of factors regarding the number of medical complaints per unit of time are an integral part of the system. A semantic discrepancy evaluator routine along with a mental status examination are used to detect the consciousness level of a user of the system. A dynamic data structure is used to record and save new patient data over time. A symptom severity analysis helps to respond to the changing conditions. System sensitivity factors may be changed at a global level or other levels to adjust the system advice as necessary.","1. A computerized system for medical self-diagnosis, the system comprising: a memory in data communication with a computing device, said memory configured to store: a static medical history objects data structure, said static medical history objects data structure comprising a specification of a plurality of attributes representative of at least one of: a symptom of at least one disease,an attribute of the at least one disease, andan anticipated rate of change in severity of the at least one disease, the anticipated rate of change including a set threshold,a modifiable data structure, said modifiable data structure comprising specifications of a plurality of attributes representative of at least one of: a medical history of a patient,a consultation history of the patient, anda patient input concerning a present symptom of the patient,a processor in data communication with said computing device, the processor configured to: receive the patient input, without physician assistance, via a direct interactive dialogue between the patient and the computing device;store the patient input in the modifiable data structure;specifically respond to the patient based on said modifiable data structure;access the static medical history objects data structure;determine an actual rate of change in severity of the at least one disease;transmit a self-diagnosis to the patient, the self-diagnosis based on the patient input, the data in the static medical history objects data structure and the data in the modifiable data structure; andtransmit, to the patient via said direct interactive dialogue, an action to take if said actual rate of change in severity exceeds said set threshold;wherein said modifiable data structure is modified by the direct interactive dialogue and said static medical history objects data structure remains unchanged by the direct interactive dialogue.","10","13/224467","2011-09-02","2012-0035962","2012-02-09","8271415","2012-09-18","Clinical Decision Support, LLC","Edwin C. Iliff","","","","","","G06F-017/00","G06F-017/00 | G06N-005/02","706/046","706/046","","","","4912038005133"
"US","US","P","B2","Apparatus and methods for monitoring transfusion of blood","Apparatus and methods are described for ensuring that blood transfused into a patient is the correct blood for that patient, is transfused in the correct manner and that a complete audit trail is created that will allow later tracing of blood from donation through to ultimate transfusion.","1. An apparatus for implementing blood sample collection, blood unit requesting, and blood unit transfusion into a patient, said apparatus comprising: a caregiver identity means comprising an electronically readable caregiver code;a patient identification wristband comprising an electronically readable patient code;a portable computer comprising a reader wherein said reader is capable of reading said caregiver code and said patient code and software to implement the process of sample collection wherein said process of sample collection comprises the step of causing said portable computer to present messages to a caregiver that indicate to said caregiver a predefined series of steps, presented step-by-step, to be performed by said caregiver in the sample collection process anda portable printer wherein said portable printer is capable of communicating with said portable computer.","20","12/354120","2009-01-15","2009-0121009","2009-05-14","8261981","2012-09-11","0848357 B.C. LTD. | NEOTERIC TECHNOLOGY ULC | HAEMONETICS CORPORATION | HAEMONETICS CANADA LTD.","Geoffrey Fletcher Auchinleck","","","","","","G07B-015/02","G07B-015/02","235/384","235/384 | 235/385 | 235/462.07 | 700/086 | 700/242 | 705/002 | 238/117 | 604/067","","","","4912037001066"
"US","US","P","B2","Display of modeled magnetic fields","Methods and systems for modeling and displaying magnetic field intensities during Transcranial Magnetic Stimulation (TMS) are described, particularly methods and system for modeling and displaying TMS using overlapping magnetic fields to stimulate deep brain regions.","1. A method of generating a Transcranial Magnetic Stimulation (TMS) treatment plan for a patient, the method comprising the steps of: displaying representations of a plurality of TMS electromagnets around a model of the patient'ss brain;calculating the intensity of the magnetic field for a plurality of brain regions including a deep brain target based on the positions of the TMS electromagnets relative to the brain and based on pre-computed magnetic field models for each of the plurality of TMS electromagnets;displaying the magnetic field intensity at the deep brain target on the model of the patient'ss brain and on non-target regions in the patient'ss brain; andmoving the representation of at least one TMS electromagnet and re-calculating the intensity of the magnetic field for the deep brain target until the magnetic field intensity at the deep brain target is above a stimulation threshold while the magnetic field intensity at non-target regions is below a stimulation threshold.","11","12/679960","2008-10-09","2011-0004450","2011-01-06","8265910","2012-09-11","CERVEL NEUROTECH, INC.","David J. Mishelevich | M. Bret Schneider","","","","","","G06F-017/50","G06F-017/50 | G06F-007/60 | G06G-007/48 | A61B-017/52 | A61B-005/04 | A61N-002/00 | A61N-001/00","703/002","703/002 | 703/001 | 703/003 | 703/004 | 703/005 | 703/006 | 600/009 | 600/010 | 600/011 | 600/013 | 600/014 | 600/015 | 600/544 | 600/545","","","","4912037004980"
"US","US","P","B2","Pharmacy personal care account","A method for providing insurance coverage to a subscriber comprises offering an insurance policy to the subscriber wherein the insurance policy comprises providing allowances to pay for one or more expenses covered by the insurance policy and providing monetary credits to the subscriber for any unused portion of a given allowance where the monetary credits can be used to cover the cost of a subsequent allowed expense. The insurance policy may be a pharmacy benefits plan. The covered expenses may be pharmacy expenses. The allowed expenses may be medical expenses which qualify under Section 213 of the US Internal Revenue Code for payment by an employer without the subscriber having to declare the payment as taxable income.","1. A computerized method for processing a health insurance claim comprising: (a) storing in a first database covered expense data comprising: (1) an identifier for a good or service covered under an insurance policy; and(2) an allowed amount for said good or service equal to a maximum amount to be paid under said insurance policy for said good or service;(b) storing in a second database personal care account data comprising for each subscriber of said insurance policy: (1) a subscriber identifier; and(2) a personal care account associated with said subscriber identifier;(c) receiving at a server claim data for a covered expense for a subscriber of said insurance policy, said claim data comprising: (1) a subscriber identifier;(2) an identifier for a good or service; and(3) an actual cost for said covered expense;(d) retrieving at said server from said first database an allowed amount for said covered expense;(e) calculating at said server a monetary credit for said covered expense equal to the difference between said allowed amount and said actual cost;(f) if said monetary credit is positive, adding said monetary credit to a balance of a personal care account associated with said subscriber identifier at said second database.","20","13/407262","2012-02-28","2012-0158427","2012-06-21","8265956","2012-09-11","Humana Inc.","Benjamin E. Slen | Cullen L. Reed | Elizabeth D. Bierbower | Maureen M. Kinser | Jonathan T. Lord | Sandra L. Bartel","","","","","","G06Q-010/00","G06Q-010/00 | G06Q-050/00 | G06Q-040/00 | A61B-005/00 | G06F-019/00","705/002","705/002 | 705/003 | 705/004","","","","4912037005026"
"US","US","P","B2","Biometrics authentication method and biometrics authentication system","A biometrics authentication system using biometrics media simplifies the process, and reduces the costs, of issuing a portable communication terminal having biometrics functions. A biometrics application program is downloaded from a server to a portable communication terminal, an area for authenticated biometrics information is caused to be created, and biometrics information on an individual card of the user is stored in a common area of the portable communication terminal. Thus, the portable communication terminal has the functions of an individual card storing biometrics information, and the portable communication terminal can be used as an individual card for biometrics authentication.","1. A biometrics authentication method, comprising the steps of: accessing a server which manages a biometrics authentication application program from a portable communication terminal having a contact-free communication unit and a mobile communication unit, via a mobile communication network;downloading said biometrics authentication application program from said server to said portable communication terminal;reading contents of an individual card which stores biometrics information to use for biometrics authentication from said individual card at a terminal device;detecting the biometrics information of a user, using a biometrics information detection unit of the terminal device after reading;verifying said biometrics information on said individual card against the biometrics information detected by said biometrics information detection unit, using the terminal device;communicating between said terminal device and said portable communication terminal to which said biometrics application program has been downloaded through said contact-free communication unit of the portable communication terminal when said verification result is satisfactory; andwriting the biometrics information on said individual card to a storage area managed by said biometrics authentication application program in a memory of said portable communication terminal through said contact-free communication unit of the portable communication terminal,and wherein said downloading further comprises: a step that said portable communication terminal accesses a second server by URL (Universal Address Locater) information embedded in said biometrics authentication application program;a step that said portable communication terminal receives a specification of said storage area managed by said biometrics authentication application program from said second server;a step of that said portable communication terminal creates said storage area of said biometrics information, in said memory; anda step of displaying that said biometrics authentication application program has completed to create said storage area in said memory, on a screen of the portable communication terminal to notify a completion of a preparation to transplant a biometrics authentication function in the individual card,and wherein said writing further comprises:a step of second displaying a registration selection menu on the screen of the portable communication terminal by operating the portable communication terminal by the user when said biometric authentication application program authorizes an access of said terminal device by communicating the terminal device with the portable communication terminal to start the biometrics authentication application program; anda step of starting the writing step by designating the registration selection menu by the user.","14","11/364367","2006-03-01","2007-0092112","2007-04-26","8261333","2012-09-04","FUJITSU LIMITED | FUJITSU FRONTECH LIMITED","Kiyotaka Awatsu | Masanori Ohkoshi | Takahiro Kudoh | Kazuhiro Akutsu | Yoshiharu Ogawa","2005-271366","JP","2005-09-20","","","H04L-029/06","H04L-029/06","726/006","726/006 | 726/005 | 726/007 | 726/009 | 726/028 | 726/029 | 713/172 | 713/185 | 713/186","","","","4912036005731"
